State,Agency Name,URL
AL,Legal Services Alabama,https://legalservicesalabama.org/apply-for-services/
AK,Alaska Legal Services Corporation,https://www.alsc-law.org/application/
AS,American Samoa Legal Aid,https://www.aslegalaid.org/
AZ,"Community Legal Services, Inc.",http://www.clsaz.org/apply.html
,"DNA - Peoples Legal Services, Inc.",https://dnalegalservices.org/contact/
,"Souther Arizona Legal Aid, Inc.",https://www.sazlegalaid.org/contact
AR,"Center for Arkansas Legal Services, Inc.",http://www.arlegalservices.org/applyonline
,"Legal Aid of Arkansas, Inc.",http://www.arlegalservices.org/applyonline
CA,Bay Area Legal Aid,https://baylegal.org/get-help/find-an-office/
,"California Indian Legal Services, Inc.",http://www.calindian.org/our-offices/
,"California Rural Legal Assistance, Inc.",http://www.crla.org/contact-us
,Central California Legal Services,https://www.centralcallegal.org/eligibility/
,"Greater Bakersfield Legal Assistance, Inc.",https://www.gbla.org/eligibilty/
,"Inland Counties Legal Services, Inc.",https://www.inlandlegal.org/node/46/apply-now
,Legal Aid Foundation of Los Angeles,https://lafla.org/help/
,Community Legal Aid SoCal,http://www.communitylegalsocal.org/help-yourself/
,"Legal Aid Society of San Diego, Inc.",https://www.lassd.org/get-help
,"Legal Services of Northern California, Inc.",https://www.lsnc.net/how-contact-us
,Neighborhood Legal Services of Los Angeles County,https://www.nlsla.org/contact-us/
CO,Colorado Legal Services,https://www.coloradolegalservices.org/node/4/contact-colorado-legal-services
CT,"Statewide Legal Services of Connecticut, Inc.",https://www.slsct.org/get-help
DE,"Legal Services Corporation of Delaware, Inc.",https://delegalhelplink.org/
DC,Neighborhood Legal Services Program of the District of Columbia,http://www.nlsp.org/
FL,"Bay Area Legal Services, Inc.",https://bals.org/get-help
,"Coast to Coast Legal Aid of South Florida, Inc.",https://www.coasttocoastlegalaid.org/about-coast-to-coast/resources-bc/
,"Community Legal Services of Mid-Florida, Inc.",https://clsmf.org/apply-for-help/eligibility/
,"Florida Rural Legal Services, Inc.",https://www.frls.org/how-to-get-help/apply-for-services/
,"Legal Services of Greater Miami, Inc.",https://www.legalservicesmiami.org/self-help
,"Legal Services of North Florida, Inc.",https://www.lsnf.org/contact/
,"Three Rivers Legal Services, Inc.",https://www.trls.org/apply-online/
GA,"Atlanta Legal Aid Society, Inc.",https://atlantalegalaid.org/get-help/
,Georgia Legal Services Program,https://gaoi.legalserver.org/modules/matter/extern_intake.php?pid=108&h=5c2a5f&
HI,Legal Aid Society of Hawaii,https://www.legalaidhawaii.org/get-help.html
ID,"Idaho Legal Aid Services, Inc.",https://www.idaholegalaid.org/node/2413/apply-legal-assistance
IL,"Land of Lincoln Legal Assistance Foundation, Inc.",https://lincolnlegal.org/contact-us/
,Legal Aid Chicago,https://www.legalaidchicago.org/get-help/am-i-eligible-for-legal-aid/
,"Prairie State Legal Services, Inc.",https://www.pslegal.org/psls-apply-online.asp
IN,"Indiana Legal Services, Inc.",https://www.indianalegalservices.org/applyonline
IA,Iowa Legal Aid,https://www.iowalegalaid.org/
KS,"Kansas Legal Services, Inc.",https://www.kansaslegalservices.org/node/63/get-help
KY,Appalachian Research and Defense Fund of Kentucky,https://www.ardfky.org/node/17/
,Kentucky Legal Aid,https://www.klaid.org/how-we-work
,Legal Aid of the Bluegrass,https://lablaw.org/apply-here
,Legal Aid Society,http://www.laslou.org/help-for-clients/i-need-help.html
LA,Acadiana Legal Service Corporation,https://www.la-law.org/get-help/
,Southeast Louisiana Legal Services Corporation,https://slls.org/get-help/
ME,"Pine Tree Legal Assistance, Inc.",https://ptla.org/contact-us
MD,Maryland Legal Aid,https://mdlaboi.legalserver.org/modules/matter/extern_intake.php?pid=129&h=daa817&
MA,"Community Legal Aid, Inc.",https://www.communitylegal.org/get-help/how-get-help
,"Northeast Legal Aid, Inc.",http://www.northeastlegalaid.org/request-legal-services
,South Coastal Counties Legal Services,http://www.sccls.org/contact.asp
,Volunteer Lawyers Project of the Boston Bar Association,https://vlpnet.org/get-help/
MI,Lakeshore Legal Aid,https://lakeshorelegalaid.org/find-legal-help/
,Legal Aid of Western Michigan,https://lawestmi.org/i-need-help/
,Legal Services of Eastern Michigan,http://www.lsem-mi.org/contact-us/
,"Legal Services of Northern Michigan, Inc.",http://www.lsnmirp.org/client.php
,Michigan Advocacy Program,https://miadvocacy.org/welcome
,"Michigan Indian Legal Services, Inc.",https://sites.google.com/a/mils3.org/www/who-we-are/contact-us
MN,"Anishinabe Legal Services, Inc.",https://www.alslegal.org/howwecanhelp.html
,"Central Minnesota Legal Services, Inc.",https://www.centralmnlegal.org/get-help/
,Legal Aid Service of Northeastern Minnesota,http://lasnem.org/need-help/
,Legal Services of Northwest Minnesota Corporation,https://lsnmlaw.org/services/
,"Southern Minnesota Regional Legal Services, Inc.",http://www.smrls.org/get-help
MS,Mississippi Center for Legal Services,http://www.mscenterforlegalservices.org/apply-for-help/
,"North Mississippi Rural Legal Services, Inc.",http://nmrls.com/
FSM,"Micronesian Legal Services, Inc.",http://micronesianlegal.org/default.asp?secID=50
MO,Legal Aid of Western Missouri,https://lawmo.org/get-legal-help/
,"Legal Services of Eastern Missouri, Inc.",https://lsem.org/get-help-now/
,Legal Services of Southern Missouri,https://www.lsosm.org/applicants/
,Mid-Missouri Legal Services Corporation,http://mmls.org/how-to-apply/
MT,Montana Legal Services Association,https://www.mtlsa.org/apply-for-services/
NE,Legal Aid of Nebraska,https://www.legalaidofnebraska.org/contact/
NV,"Nevada Legal Services, Inc.",https://nlslaw.net/contact/
NH,"Legal Advice & Referral Center, Inc.",https://nhlegalaid.org/about/legal-advice-and-referral-center
NJ,"Central Jersey Legal Services, Inc.",https://www.lsnj.org/cjls/
,"Essex-Newark Legal Services Project, Inc.",https://www.lsnj.org/enls/
,Legal Services of Northwest Jersey,https://www.lsnj.org/lsnwj/
,Northeast New Jersey Legal Services Corporation,https://www.northeastnjlegalservices.org/contactus
,"South Jersey Legal Services, Inc.",https://www.lsnj.org/sjls/
NM,New Mexico Legal Aid,https://www.newmexicolegalaid.org/
NY,"Legal Aid Society of Mid-New York, Inc.",http://www.lasmny.org/Mid-NY/HelpLine.shtm
,"Legal Aid Society of Northeastern New York, Inc.",https://www.lasnny.org/get-help/
,"Legal Assistance of Western New York, Inc.",https://www.lawny.org/node/54/find-lawyer
,Legal Services NYC,https://www.legalservicesnyc.org/component/content/article/903?Itemid=191
,Legal Services of the Hudson Valley,https://lshv.org/request-legal-assistance-now/
,"Nassau/Suffolk Law Services Committee, Inc.",https://www.nslawservices.org/contact-us
,"Neighborhood Legal Services, Inc.",https://nls.org/contact-forms/
NC,"Legal Aid of North Carolina, Inc.",http://www.legalaidnc.org/get-help/apply-online
ND,Legal Services of North Dakota,http://www.legalassist.org/?id=41
OH,"Community Legal Aid Services, Inc.",https://www.communitylegalaid.org/apply
,"Legal Aid of Western Ohio, Inc.",https://legalaidline.lawolaw.org/apply-legal-help/
,The Legal Aid Society of Cleveland,https://lasclev.org/contact/
,Legal Aid Society of Greater Cincinnati,https://www.lascinti.org/get-help/
,Ohio State Legal Services,https://www.oslsa.org/
OK,"Legal Aid Services of Oklahoma, Inc.",http://www.legalaidok.org/if-you-need-help/
,"Oklahoma Indian Legal Services, Inc.",http://www.oilsonline.org/contact.html
OR,Legal Aid Services of Oregon,https://lasoregon.org/services/
PA,"Laurel Legal Services, Inc.",http://www.laurellegalservices.org/counties/
,Legal Aid of Southeastern Pennsylvania,http://lasp.org/node/37
,"MidPenn Legal Services, Inc.",https://www.midpenn.org/who-we-are/contact.html
,Neighborhood Legal Services Association,https://nlsa.us/legal-resources-2/request-service/
,"North Penn Legal Services, Inc.",https://www.northpennlegal.org/get-help
,Northwestern Legal Services,http://www.nwls.org/Service.htm
,Philadelphia Legal Assistance Center,https://www.philalegal.org/getlegalhelp
,"Southwestern Pennsylvania Legal Services, Inc.",https://spla.org/contact-us/
PR,"Community Law Office, Inc.",http://www.derecho.inter.edu/servicios/oficina-legal-comunidad
,"Puerto Rico Legal Services, Inc.",https://www.servicioslegales.org/contact-2/
RI,"Rhode Island Legal Services, Inc.",http://www.rils.org/contact.cfm
SC,"South Carolina Legal Services, Inc.",https://sclegal.org/
SD,"Dakota Plains Legal Services, Inc.",https://www.dpls.org/
,East River Legal Services,http://erlservices.org/services/
TN,Legal Aid of East Tennessee,https://www.laet.org/online-intake/
,Legal Aid Society of Middle Tennessee and the Cumberlands,https://las.org/find-help/
,"Memphis Area Legal Services, Inc.",http://www.malsi.org/client-services/
,"West Tennessee Legal Services, Inc.",https://www.wtls.org/apply-for-services/
TX,Legal Aid of NorthWest Texas,https://internet.lanwt.org/gethelp
,Lone Star Legal Aid,http://www.lonestarlegal.org/
,"Texas RioGrande Legal Aid, Inc.",https://www.trla.org/help
UT,"Utah Legal Services, Inc.",https://www.utahlegalservices.org/node/16/who-qualifies-get-help-utah-legal-services
VT,Legal Services Vermont,https://www.vtlegalaid.org/contact-locations
VI,"Legal Services of the Virgin Islands, Inc.",http://lsvilaw.org/what-we-do/intake-form/
VA,"Blue Ridge Legal Services, Inc.",http://brls.org/eligibility-how-to-apply-for-services/
,"Central Virginia Legal Aid Society, Inc.",http://cvlas.org/how-to-apply-for-services/
,Legal Aid Society of Eastern Virginia,https://www.laseva.org/node/17/apply-services-online
,"Legal Services of Northern Virginia, Inc.",http://www.lsnv.org/get-help/how-do-i-apply/
,"Southwest Virginia Legal Aid Society, Inc.",https://www.swvalegalaid.org/blank-3
,"Virginia Legal Aid Society, Inc.",http://vlas.org/get-legal-help/ways-to-apply/
WA,Northwest Justice Project,https://nwjustice.org/get-legal-help
WV,"Legal Aid of West Virginia, Inc.",https://www.lawv.net/Get-Help/Apply-for-Help
WI,"Legal Action of Wisconsin, Inc.",https://www.legalaction.org/contact-us
,"Wisconsin Judicare, Inc.",http://www.judicare.org/Content/How_to_Apply.cfm
WY,"Legal Aid of Wyoming, Inc.",https://www.lawyoming.org/apply-online
