State,Agency Name,URL,Counties Served
AL,Legal Services Alabama,https://legalservicesalabama.org/apply-for-services/,All
AK,Alaska Legal Services Corporation,https://www.alsc-law.org/application/,All
AS,American Samoa Legal Aid,https://www.aslegalaid.org/,All
AZ,"Community Legal Services, Inc.",http://www.clsaz.org/apply.html,"La Paz, Maricopa, Mohave, Yavapi, Yuma"
,"DNA - Peoples Legal Services, Inc.",https://dnalegalservices.org/contact/,"Coconino (AZ), Apache (AZ, the Navajo and Hopi Reservation areas), Navajo (AZ, the Navajo and Hopi Reservation areas), San Juan (NM); Native Americans living on or near the Navajo Reservation in Arizona, New Mexico and Utah, and the Hopi Reservation in Arizona, and members living off reservation who have cases which require litigation in tribal court; Native Americans living on or near the Jicarilla Indian Reservation "
,"Souther Arizona Legal Aid, Inc.",https://www.sazlegalaid.org/contact,"Apache (except the Navajo and Hopi Reservations), Cochise, Gila, Graham, Greenlee, Navajo (except the Navajo and Hopi Reservations), Pima, Pinal, Santa Cruz; Native Americans living in Gila and Graham counties who are members of the San Carlos Apache Indian Reservations and tribal members living off reservation who have cases requiring litigation in tribal court; Native Americans living off reservation in Maricopa; Native Americans living on or near the Tohono O'odham Reservation in Pima, Pinal & Maricopa Counties and Tohono O'odham tribal memebrs living off reservation who have cases requiring litigation in the Tohono O'odham National Court; and Native Americans living in: (1) Fort Apache Indian Reservation (covering portions of Gila, Apache, and Navajo Counties); (2) Gila River Indian Community in Pinal & Maricopa Counties, Ak-Chin Indian Community in Pinal, Cocopah Indian Community and Ft. Yuma Indian Community in Yuma; (3) Salt River Pima-Maricopa Indian Community & Ft. McDowell Mohave-Apache Tribe in Maricopa; (4) Camp Verde Yavapi-Apache Indian Community in Yavapi; (5) Pascua Yaqui Indian Community in Pima, and tribal members in living off reservations who have cases that require litigation in tribal court"
AR,"Center for Arkansas Legal Services, Inc.",http://www.arlegalservices.org/applyonline,"Arkansas, Ashley, Bradley, Calhoun, Chicot, Clark, Cleveland, Columbia, Conway, Crawford, Dallas, Deshua, Drew, Faulkner, Franklin, Garland, Grant, Hempstead, Hot Spring, Howard, Jefferson, Johnson, Lafayette, Lincoln, Little River, Logan, Lonoke, Miller, Montgomery, Nevada, Ouachita, Perry, Pike, Polk, Pope, Prairie, Pulaski, Saline, Scott, Sebastian, Sevier, Union, White, Yell"
,"Legal Aid of Arkansas, Inc.",http://www.arlegalservices.org/applyonline,"Baxter, Benton, Boone, Carroll, Clay, Clebure, Craighead, Crittenden, Cross, Fulton, Greene, Independence, Izard, Jackson, Lawrence, Lee, Madison, Marion, Mississippi, Monroe, Newton, Phillips, Poinsett, Randolph, St. Francis, Searcy, Sharp, Stone, Van Buren, Washington, Woodruff"
CA,Bay Area Legal Aid,https://baylegal.org/get-help/find-an-office/,"Alameda, Contra Costa, Marin, Napa, San Francisco, San Mateo, Santa Clara (except Gilroy & Morgan Hill areas)"
,"California Indian Legal Services, Inc.",http://www.calindian.org/our-offices/,"Alpine, Inyo, Mono; Native Americans living in all counties in California including those who live on its 102 Native American Reservations"
,"California Rural Legal Assistance, Inc.",http://www.crla.org/contact-us,"Colusa, Imperial, Kern (northwest portion), Madera, Monterey, San Benito, San Joaquin, San Luis Obispo, Santa Barbara, Santa Clara (Gilroy and Morgan Hill area), Santa Cruz, Sonoma, Stanislaus, Sutter, Ventura, Yuba"
,Central California Legal Services,https://www.centralcallegal.org/eligibility/,"Fresno, Kings, Mariposa, Merced, Tulare, Tuolumne"
,"Greater Bakersfield Legal Assistance, Inc.",https://www.gbla.org/eligibilty/,Kern (except northwest portion)
,"Inland Counties Legal Services, Inc.",https://www.inlandlegal.org/node/46/apply-now,"Riverside, San Bernardino"
,Legal Aid Foundation of Los Angeles,https://lafla.org/help/,"Los Angeles (Greater Long Beach & Los Angeles Harbor area, Greater City of Los Angeles area)"
,Community Legal Aid SoCal,http://www.communitylegalsocal.org/help-yourself/,"Orange, Los Angeles (some southeast cities)"
,"Legal Aid Society of San Diego, Inc.",https://www.lassd.org/get-help,San Diego
,"Legal Services of Northern California, Inc.",https://www.lsnc.net/how-contact-us,"Amador, Butte, Calaveras, Del Norte, El Dorado, Glenn, Humboldt, Lake, Lassen, Mendocino, Modoc, Nevada, Placer, Plumas, Sacramento, Shasta, Sierra, Siskiyou, Solano, Tehama, Trinity, Yolo"
,Neighborhood Legal Services of Los Angeles County,https://www.nlsla.org/contact-us/,"Los Angeles (San Fernando, Santa Clarita and Antelope Valleys, Glendal, Burbank, San Gabriel, Pomona Valley including Pasadena)"
CO,Colorado Legal Services,https://www.coloradolegalservices.org/node/4/contact-colorado-legal-services,All
CT,"Statewide Legal Services of Connecticut, Inc.",https://www.slsct.org/get-help,All
DE,"Legal Services Corporation of Delaware, Inc.",https://delegalhelplink.org/,All
DC,Neighborhood Legal Services Program of the District of Columbia,http://www.nlsp.org/,All
FL,"Bay Area Legal Services, Inc.",https://bals.org/get-help,"Hillsborough, Manatee, Pasco, Pinellas, Sarasota"
,"Coast to Coast Legal Aid of South Florida, Inc.",https://www.coasttocoastlegalaid.org/about-coast-to-coast/resources-bc/,"Broward, Collier"
,"Community Legal Services of Mid-Florida, Inc.",https://clsmf.org/apply-for-help/eligibility/,"Brevard, Citrus, Flagler, Hernando, Lake, Marion, Orange, Osceola, Putnam, Seminole, Sumter, Volusia"
,"Florida Rural Legal Services, Inc.",https://www.frls.org/how-to-get-help/apply-for-services/,"Charlotte, DeSoto, Glades, Hardee, Hendry, Highlands, Indian River, Lee, Marin, Okeechobee, Palm Beach, Polk, St. Lucie"
,"Legal Services of Greater Miami, Inc.",https://www.legalservicesmiami.org/self-help,"Miami-Dade, Monroe"
,"Legal Services of North Florida, Inc.",https://www.lsnf.org/contact/,"Bay, Calhoun, Escambia, Franklin, Gadsden, Gulf, Holmes, Jackson, Jefferson, Leon, Liberty, Okaloosa, Santa Rosa, Wakulla, Walton, Washington"
,"Three Rivers Legal Services, Inc.",https://www.trls.org/apply-online/,"Alachua, Baker, Bradford, Clay, Columbia, Dixie, Duval, Gilchirst, Hamilton, Lafayette, Levy, Madison, Nassau, St. Johns, Suwannee, Taylor, Union"
GA,"Atlanta Legal Aid Society, Inc.",https://atlantalegalaid.org/get-help/,"Clayton, Cobb, DeKalb, Fulton, Gwinnett"
,Georgia Legal Services Program,https://gaoi.legalserver.org/modules/matter/extern_intake.php?pid=108&h=5c2a5f&,"Appling, Atkinson, Bacon, Baker, Baldwin, Banks, Barrow, Bartow, Ben Hill, Berrien, Bibb, Bleckley, Brantley, Brooks, Bryan, Bulloch, Burke, Butts, Calhoun, Camden, Candler, Carroll, Catoosa, Charlton, Chatham, Chattahoochee, Chattooga, Cherokee, Clarke, Clay, Clinch, Coffee, Colquitt, Columbia, Cook, Coweta, Crawford, Crisp, Dade, Dawson, Decatur, Dodge, Dooly, Dougherty, Douglas, Early, Echols, Effingham, Elbert, Emanuel, Evans, Fannin, Fayette, Floyd, Forsyth, Franklin, Gilmer, Glascock, Glynn, Gordon, Grady, Greene, Habersham, Hall, Hancock, Haralson, Harris, Hart, Heard, Henry, Houston, Irwin, Jackson, Jasper, Jeff Davis, Jefferson, Jenkins, Johnson, Jones, Lamar, Lanier, Laurens, Lee, Liberty, Lincoln, Long, Lowndes, Lumpkin, McDuffie, McIntosh, Macon, Madison, Marion, Meriwether, Miller, Mitchell, Monroe, Montgomery, Morgan, Murray, Muscogee, Newton, Oconee, Oglethorpe, Paulding, Peach, Pickens, Pierce, Pike, Polk, Pulaski, Putnam, Quitman, Rabun, Randolph, Richmond, Rockdale, Schley, Screven, Seminole, Spalding, Stephens, Stewart, Sumter, Talbot, Taliaferro, Tattnall, Taylor, Telfair, Terrell, Thomas, Tift, Toombs, Towns, Treutlen, Troup, Turner, Twiggs, Union, Upson, Walker, Walton, Ware, Warren, Washington, Wayne, Webster, Wheeler, White, Whitfield, Wilcox, Wilkes, Wilkinson, Worth"
HI,Legal Aid Society of Hawaii,https://www.legalaidhawaii.org/get-help.html,All
ID,"Idaho Legal Aid Services, Inc.",https://www.idaholegalaid.org/node/2413/apply-legal-assistance,All
IL,"Land of Lincoln Legal Assistance Foundation, Inc.",https://lincolnlegal.org/contact-us/,"Adams, Alexander, Bond, Brown, Calhoun, Cass, Champaign, Christian, Clark, Clay, Clinton, Coles, Crawford, Cumberland, De Witt, Douglas, Edgar, Edwards, Effingham, Fayette, Ford, Franklin, Gallatin, Greene, Hamilton, Hancock, Hardin, Jackson, Jasper, Jefferson, Jersey, Johnson, Lawrence, Logan, Macon, Macoupin, Madison, Marion, Mason, Massac, Menard, Monroe, Montgomery, Morgan, Moultrie, Perry, Piatt, Pike, Pope, Pulaski, Randolph, Richland, St. Clair, Saline, Sangamon, Schuyler, Scott, Shelby, Union, Vermilion, Wabash, Washington, Wayne, White, Williamson"
,Legal Aid Chicago,https://www.legalaidchicago.org/get-help/am-i-eligible-for-legal-aid/,
,"Prairie State Legal Services, Inc.",https://www.pslegal.org/psls-apply-online.asp,"Boone, Bureau, Carroll, DeKalb, DuPage, Fulton, Grundy, Henderson, Henry, Iroquois, Jo Daviess, Kane, Kankakee, Kendall, Knox, Lake, LaSalle, Lee, Livingston, McDonough, McHenry, McLean, Marshall, Mercer, Ogle, Peoria, Putnam, Rock Island, Stark, Stephenson, Tazewell, Warren, Whiteside, Will, Winnebago, Woodford"
IN,"Indiana Legal Services, Inc.",https://www.indianalegalservices.org/applyonline,All
IA,Iowa Legal Aid,https://www.iowalegalaid.org/,All
KS,"Kansas Legal Services, Inc.",https://www.kansaslegalservices.org/node/63/get-help,All
KY,Appalachian Research and Defense Fund of Kentucky,https://www.ardfky.org/node/17/,"Adair, Bell, Breathitt, Casey, Clark, Clay, Clinton, Cumberland, Estill, Floyd, Garrard, Harlan, Jackson, Johnson, Knott, Knox, Laurel, Lawrence, Lee, Leslie, Letcher, Lincoln, McCreary, Madison, Magoffin, Martin, Monroe, Owsley, Perry, Pike, Powell, Pulaski, Rockcastle, Russell, Wayne, Whitley, Wolfe"
,Kentucky Legal Aid,https://www.klaid.org/how-we-work,"Allen, Ballard, Barren, Butler, Caldwell, Calloway, Carlisle, Christian, Crittenden, Daviess, Edmonson, Fulton, Graves, Green, Hancock, Hart, Henderson, Hickman, Hopkins, Livingston, Logan, Lyon, McCracken, McLean, Marshall, Metcalfe, Muhlenberg, Ohio, Simpson, Taylor, Todd, Trigg, Union, Warren, Webster"
,Legal Aid of the Bluegrass,https://lablaw.org/apply-here,"Anderson, Bath, Boone, Bourbon, Boyd, Boyle, Bracken, Campbell, Carroll, Carter, Elliott, Fayette, Fleming, Franklin, Gallatin, Grant, Greenup, Harrison, Jessamine, Kenton, Lewis, Mason, Menifee, Mercer, Montgomery, Morgan, Nicholas, Owen, Pendleton, Robertson, Rowan, Scott, Woodford"
,Legal Aid Society,http://www.laslou.org/help-for-clients/i-need-help.html,"Breckinridge, Bullitt, Grayson, Hardin, Henry, Jefferson, Larue, Marion, Meade, Nelson, Oldham, Shelby, Spencer, Trimble, Washington"
LA,Acadiana Legal Service Corporation,https://www.la-law.org/get-help/,"Acadia Parish, Allen Parish, Avoyelles Parish, Beauregard Parish, Bienville Parish, Bossier Parish, Caddo Parish, Calcasieu Parish, Caldwell Parish, Cameron Parish, Catahoula Parish, Claiborne Parish, Concordia Parish, De Soto Parish, East Carroll Parish, Evangeline Parish, Franklin Parish, Grant Parish, Iberia Parish, Jackson Parish, Jefferson Davis Parish, La Salle Parish, Lafayette Parish, Lincoln Parish, Madison Parish, Morehouse Parish, Natchitoches Parish, Ouachita Parish, Rapides Parish, Red River Parish, Richland Parish, Sabine Parish, St. Landry Parish, St. Martin Parish, St. Mary Parish, Tensas Parish, Union Parish, Vermilion Parish, Vernon Parish, Webster Parish, West Carroll Parish, Winn Parish"
,Southeast Louisiana Legal Services Corporation,https://slls.org/get-help/,"Ascension Parish, Assumption Parish, East Baton Rouge Parish, East Feliciana Parish, Iberville Parish, Jefferson Parish, Lafourche Parish, Livingston Parish, Orleans Parish, Plaquemines Parish, Pointe Coupee Parish, St. Bernard Parish, St. Charles Parish, St. Helena Parish, St. James Parish, St. John the Baptist Parish, St. Tammany Parish, Tangipahoa Parish, Terrebonne Parish, Washington Parish, West Baton Rouge Parish, West Feliciana Parish"
ME,"Pine Tree Legal Assistance, Inc.",https://ptla.org/contact-us,All
MD,Maryland Legal Aid,https://mdlaboi.legalserver.org/modules/matter/extern_intake.php?pid=129&h=daa817&,All
MA,"Community Legal Aid, Inc.",https://www.communitylegal.org/get-help/how-get-help,"Berkshire, Franklin, Hampden, Hampshire, Worcester"
,"Northeast Legal Aid, Inc.",http://www.northeastlegalaid.org/request-legal-services,Essex
,South Coastal Counties Legal Services,http://www.sccls.org/contact.asp,"Barnstable, Dukes, Nantucket, Plymouth"
,Volunteer Lawyers Project of the Boston Bar Association,https://vlpnet.org/get-help/,"Middlesex, Norfolk, Suffolk"
MI,Lakeshore Legal Aid,https://lakeshorelegalaid.org/find-legal-help/,"Macomb, Oakland, Wayne"
,Legal Aid of Western Michigan,https://lawestmi.org/i-need-help/,"Allegan, Berrien, Cass, Ionia, Kalamazoo, Kent, Lake, Mason, Mecosta, Montcalm, Muskegon, Newaygo, Oceana, Osceola, Ottawa, St. Joseph, Van Buren"
,Legal Services of Eastern Michigan,http://www.lsem-mi.org/contact-us/,"Arenac, Bay, Clare, Genesee, Gladwin, Gratiot, Huron, Isabella, Lapeer, Midland, Saginaw, St. Clair, Sanilac, Tuscola"
,"Legal Services of Northern Michigan, Inc.",http://www.lsnmirp.org/client.php,"Alcona, Alger, Alpena, Antrim, Baraga, Benzie, Charlevoix, Cheboygan, Chippewa, Crawford, Delta, Dickinson, Emmet, Gogebic, Grand Traverse, Houghton, Iosco, Iron, Kalkaska, Keweenaw, Leelanau, Luce, Mackinac, Manistee, Marquette, Menominee, Missaukee, Montmorency, Ogemaw, Ontonagon, Oscoda, Otsego, Presque Isle, Roscommon, Schoolcraft, Wexford"
,Michigan Advocacy Program,https://miadvocacy.org/welcome,"Barry, Branch, Calhoun, Clinton, Eaton, Hillsdale, Ingham, Jackson, Lenawee, Livingston, Monroe, Shiawassee, Washtenaw"
,"Michigan Indian Legal Services, Inc.",https://sites.google.com/a/mils3.org/www/who-we-are/contact-us,"Native Americans living in all counties in Michigan, including those who live on its Indian Reservations of Keewenaw Bay, Lac Vieux Desert, Hannaville, Bay Mills, Sault Ste Marie, Grand Traverse Band and Isabella"
MN,"Anishinabe Legal Services, Inc.",https://www.alslegal.org/howwecanhelp.html,"Native Americans living within the boundaries of the Leech Lake, White Earth and Red Lake Indian Reservations"
,"Central Minnesota Legal Services, Inc.",https://www.centralmnlegal.org/get-help/,"Anoka, Benton, Big Stone, Chippewa, Chisago, Hennepin, Isanti, Kandiyohi, Lac qui Parle, Lincoln, Lyon, Meeker, Mille Lacs, Morrison, Renville, Sherburne, Stearns, Swift, Todd, Wright, Yellow Medicine"
,Legal Aid Service of Northeastern Minnesota,http://lasnem.org/need-help/,"Aitkin, Carlton, Cass, Cook, Crow Wing, Itasca, Kanabec, Koochiching, Lake, Pine, St. Louis"
,Legal Services of Northwest Minnesota Corporation,https://lsnmlaw.org/services/,"Becker, Beltrami, Clay, Clearwater, Douglas, Grant, Hubbard, Kittson, Lake of the Woods, Mahnomen, Marshall, Norman, Otter Tail, Pennington, Polk, Pope, Red Lake, Roseau, Stevens, Traverse, Wadena, Wilkin"
,"Southern Minnesota Regional Legal Services, Inc.",http://www.smrls.org/get-help,"Blue Earth, Brown, Carver, Cottonwood, Dakota, Dodge, Faribault, Fillmore, Freeborn, Goodhue, Houston, Jackson, Le Sueur, McLeod, Martin, Mower, Murray, Nicollet, Nobles, Olmsted, Pipestone, Ramsey, Redwood, Rice, Rock, Scott, Sibley, Steele, Wabasha, Waseca, Washington, Watonwan, Winona"
MS,Mississippi Center for Legal Services,http://www.mscenterforlegalservices.org/apply-for-help/,"Adams, Amite, Claiborne, Clarke, Copiah, Covington, Forrest, Franklin, George, Greene, Hancock, Harrison, Hinds, Holmes, Jackson, Jasper, Jefferson, Jefferson Davis, Jones, Kemper, Lamar, Lauderdale, Lawrence, Leake, Lincoln, Madison, Marion, Neshoba, Newton, Noxubee, Pearl River, Perry, Pike, Rankin, Scott, Simpson, Smith, Stone, Walthall, Warren, Wayne, Wilkinson, Yazoo,Native Americans living on the Choctaw Indian Reservation in the counties of Jones, Leake, Neshoba, Newton, Noxubee, Scott, and Winston"
,"North Mississippi Rural Legal Services, Inc.",http://nmrls.com/,"Alcorn, Attala, Benton, Bolivar, Calhoun, Carroll, Chickasaw, Choctaw, Clay, Coahoma, DeSoto, Grenada, Humphreys, Issaquena, Itawamba, Lafayette, Lee, Leflore, Lowndes, Marshall, Monroe, Montgomery, Oktibbeha, Panola, Pontotoc, Prentiss, Quitman, Sharkey, Sunflower, Tallahatchie, Tate, Tippah, Tishomingo, Tunica, Union, Washington, Webster, Winston, Yalobusha"
FSM,"Micronesian Legal Services, Inc.",http://micronesianlegal.org/default.asp?secID=50,All
MO,Legal Aid of Western Missouri,https://lawmo.org/get-legal-help/,"Andrew, Atchison, Barton, Bates, Benton, Buchanan, Caldwell, Camden, Carroll, Cass, Clay, Clinton, Daviess, DeKalb, Gentry, Grundy, Harrison, Henry, Hickory, Holt, Jackson, Jasper, Johnson, Lafayette, Linn, Livingston, McDonald, Mercer, Morgan, Newton, Nodaway, Pettis, Platte, Putnam, Ray, St. Clair, Saline, Sullivan, Vernon, Worth"
,"Legal Services of Eastern Missouri, Inc.",https://lsem.org/get-help-now/,"Adair, Clark, Franklin, Jefferson, Knox, Lewis, Lincoln, Macon, Marion, Monroe, Montgomery, Pike, Ralls, St. Charles, St. Louis, Schuyler, Scotland, Shelby, Warren, Washington, St. Louis city"
,Legal Services of Southern Missouri,https://www.lsosm.org/applicants/,"Barry, Bollinger, Butler, Cape Girardeau, Carter, Cedar, Christian, Crawford, Dade, Dallas, Dent, Douglas, Dunklin, Gasconade, Greene, Howell, Iron, Laclede, Lawrence, Madison, Maries, Mississippi, New Madrid, Oregon, Ozark, Pemiscot, Perry, Phelps, Polk, Pulaski, Reynolds, Ripley, Ste. Genevieve, St. Francois, Scott, Shannon, Stoddard, Stone, Taney, Texas, Wayne, Webster, Wright"
,Mid-Missouri Legal Services Corporation,http://mmls.org/how-to-apply/,"Audrain, Boone, Callaway, Chariton, Cole, Cooper, Howard, Miller, Moniteau, Osage, Randolph"
MT,Montana Legal Services Association,https://www.mtlsa.org/apply-for-services/,All
NE,Legal Aid of Nebraska,https://www.legalaidofnebraska.org/contact/,All
NV,"Nevada Legal Services, Inc.",https://nlslaw.net/contact/,All
NH,"Legal Advice & Referral Center, Inc.",https://nhlegalaid.org/about/legal-advice-and-referral-center,All
NJ,"Central Jersey Legal Services, Inc.",https://www.lsnj.org/cjls/,"Mercer, Middlesex, Union"
,"Essex-Newark Legal Services Project, Inc.",https://www.lsnj.org/enls/,Essex
,Legal Services of Northwest Jersey,https://www.lsnj.org/lsnwj/,
,Northeast New Jersey Legal Services Corporation,https://www.northeastnjlegalservices.org/contactus,"Bergen, Hudson, Passaic"
,"South Jersey Legal Services, Inc.",https://www.lsnj.org/sjls/,"Monmouth, Ocean,Atlantic, Burlington, Camden, Cape May, Cumberland, Gloucester, Salem"
NM,New Mexico Legal Aid,https://www.newmexicolegalaid.org/,All
NY,"Legal Aid Society of Mid-New York, Inc.",http://www.lasmny.org/Mid-NY/HelpLine.shtm,"Broome, Cayuga, Chenango, Cortland, Delaware, Herkimer, Jefferson, Lewis, Madison, Oneida, Onondaga, Oswego, Otsego"
,"Legal Aid Society of Northeastern New York, Inc.",https://www.lasnny.org/get-help/,"Albany, Clinton, Columbia, Essex, Franklin, Fulton, Greene, Hamilton, Montgomery, Rensselaer, St. Lawrence, Saratoga, Schenectady, Schoharie, Warren, Washington"
,"Legal Assistance of Western New York, Inc.",https://www.lawny.org/node/54/find-lawyer,"Allegany, Cattaraugus, Chautauqua, Chemung, Livingston, Monroe, Ontario, Schuyler, Seneca, Steuben, Tioga, Tompkins, Wayne, Yates"
,Legal Services NYC,https://www.legalservicesnyc.org/component/content/article/903?Itemid=191,"Bronx, Kings, New York, Queens, Richmond"
,Legal Services of the Hudson Valley,https://lshv.org/request-legal-assistance-now/,"Dutchess, Orange, Putnam, Rockland, Sullivan, Ulster, Westchester"
,"Nassau/Suffolk Law Services Committee, Inc.",https://www.nslawservices.org/contact-us,"Nassau, Suffolk"
,"Neighborhood Legal Services, Inc.",https://nls.org/contact-forms/,"Erie, Genesee, Niagara, Orleans, Wyoming"
NC,"Legal Aid of North Carolina, Inc.",http://www.legalaidnc.org/get-help/apply-online,All
ND,Legal Services of North Dakota,http://www.legalassist.org/?id=41,All
OH,"Community Legal Aid Services, Inc.",https://www.communitylegalaid.org/apply,"Columbiana, Mahoning, Medina, Portage, Stark, Summit, Trumbull, Wayne"
,"Legal Aid of Western Ohio, Inc.",https://legalaidline.lawolaw.org/apply-legal-help/,"Allen, Ashland, Auglaize, Champaign, Clark, Crawford, Darke, Defiance, Erie, Fulton, Greene, Hancock, Hardin, Henry, Huron, Logan, Lucas, Mercer, Miami, Montgomery, Ottawa, Paulding, Preble, Putnam, Richland, Sandusky, Seneca, Shelby, Van Wert, Williams, Wood, Wyandot"
,The Legal Aid Society of Cleveland,https://lasclev.org/contact/,"Ashtabula, Cuyahoga, Geauga, Lake, Lorain"
,Legal Aid Society of Greater Cincinnati,https://www.lascinti.org/get-help/,"Brown, Butler, Clermont, Clinton, Hamilton, Highland, Warren"
,Ohio State Legal Services,https://www.oslsa.org/,"Adams, Athens, Belmont, Carroll, Coshocton, Delaware, Fairfield, Fayette, Franklin, Gallia, Guernsey, Harrison, Hocking, Holmes, Jackson, Jefferson, Knox, Lawrence, Licking, Madison, Marion, Meigs, Monroe, Morgan, Morrow, Muskingum, Noble, Perry, Pickaway, Pike, Ross, Scioto, Tuscarawas, Union, Vinton, Washington"
OK,"Legal Aid Services of Oklahoma, Inc.",http://www.legalaidok.org/if-you-need-help/,"Adair, Alfalfa, Atoka, Beaver, Beckham, Blaine, Bryan, Caddo, Canadian, Carter, Cherokee, Choctaw, Cimarron, Cleveland, Coal, Comanche, Cotton, Craig, Creek, Custer, Delaware, Dewey, Ellis, Garfield, Garvin, Grady, Grant, Greer, Harmon, Harper, Haskell, Hughes, Jackson, Jefferson, Johnston, Kay, Kingfisher, Kiowa, Latimer, Le Flore, Lincoln, Logan, Love, McClain, McCurtain, McIntosh, Major, Marshall, Mayes, Murray, Muskogee, Noble, Nowata, Okfuskee, Oklahoma, Okmulgee, Osage, Ottawa, Pawnee, Payne, Pittsburg, Pontotoc, Pottawatomie, Pushmataha, Roger Mills, Rogers, Seminole, Sequoyah, Stephens, Texas, Tillman, Tulsa, Wagoner, Washington, Washita, Woods, Woodward"
,"Oklahoma Indian Legal Services, Inc.",http://www.oilsonline.org/contact.html,"Native Americans living in all counties in Oklahoma, including its more than 34 Indian tribes"
OR,Legal Aid Services of Oregon,https://lasoregon.org/services/,All
PA,"Laurel Legal Services, Inc.",http://www.laurellegalservices.org/counties/,"Armstrong, Cambria, Clarion, Indiana, Jefferson, Westmoreland"
,Legal Aid of Southeastern Pennsylvania,http://lasp.org/node/37,"Bucks, Chester, Delaware, Montgomery"
,"MidPenn Legal Services, Inc.",https://www.midpenn.org/who-we-are/contact.html,"Adams, Bedford, Berks, Blair, Centre, Clearfield, Cumberland, Dauphin, Franklin, Fulton, Huntingdon, Juniata, Lancaster, Lebanon, Mifflin, Perry, Schuylkill, York"
,Neighborhood Legal Services Association,https://nlsa.us/legal-resources-2/request-service/,
,"North Penn Legal Services, Inc.",https://www.northpennlegal.org/get-help,"Bradford, Carbon, Clinton, Columbia, Lackawanna, Lehigh, Luzerne, Lycoming, Monroe, Montour, Northampton, Northumberland, Pike, Snyder, Sullivan, Susquehanna, Tioga, Union, Wayne, Wyoming"
,Northwestern Legal Services,http://www.nwls.org/Service.htm,"Cameron, Crawford, Elk, Erie, Forest, McKean, Mercer, Potter, Venango, Warren"
,Philadelphia Legal Assistance Center,https://www.philalegal.org/getlegalhelp,Philadelphia
,"Southwestern Pennsylvania Legal Services, Inc.",https://spla.org/contact-us/,"Fayette, Greene, Somerset, Washington"
PR,"Community Law Office, Inc.",http://www.derecho.inter.edu/servicios/oficina-legal-comunidad,San Juan Municipio B (Hato Rey)
,"Puerto Rico Legal Services, Inc.",https://www.servicioslegales.org/contact-2/,"Adjuntas Municipio, Aguada Municipio, Aguadilla Municipio, Aguas Buenas Municipio, Aibonito Municipio, Anasco Municipio, Arecibo Municipio, Arroyo Municipio, Barceloneta Municipio, Barranquitas Municipio, Bayamon Municipio, Cabo Rojo Municipio, Caguas Municipio, Camuy Municipio, Canovanas Municipio, Carolina Municipio, Catano Municipio, Cayey Municipio, Ceiba Municipio, Ciales Municipio, Cidra Municipio, Coamo Municipio, Comerio Municipio, Corozal Municipio, Culebra Municipio, Dorado Municipio, Fajardo Municipio, Florida Municipio, Guanica Municipio, Guayama Municipio, Guayanilla Municipio, Guaynabo Municipio, Gurabo Municipio, Hatillo Municipio, Hormigueros Municipio, Humacao Municipio, Isabela Municipio, Jayuya Municipio, Juana Diaz Municipio, Juncos Municipio, Lajas Municipio, Lares Municipio, Las Marias Municipio, Las Piedras Municipio, Loiza Municipio, Luquillo Municipio, Manati Municipio, Maricao Municipio, Maunabo Municipio, Mayaguez Municipio, Moca Municipio, Morovis Municipio, Naguabo Municipio, Naranjito Municipio, Orocovis Municipio, Patillas Municipio, Penuelas Municipio, Ponce Municipio, Quebradillas Municipio, Rincon Municipio, Rio Grande Municipio, Sabana Grande Municipio, Salinas Municipio, San German Municipio, San Juan Municipio (except Hato Rey), San Lorenzo Municipio, San Sebastian Municipio, Santa Isabel Municipio, Toa Alta Municipio, Toa Baja Municipio, Trujillo Alto Municipio, Utuado Municipio, Vega Alta Municipio, Vega Baja Municipio, Vieques Municipio, Villalba Municipio, Yabucoa Municipio, Yauco Municipio"
RI,"Rhode Island Legal Services, Inc.",http://www.rils.org/contact.cfm,All
SC,"South Carolina Legal Services, Inc.",https://sclegal.org/,All
